<?xml version="1.0"?>
<!DOCTYPE Report
[
<!ELEMENT Report (General ,(Doc|BPT)) >
<!ATTLIST Report ver CDATA #REQUIRED tmZone CDATA #REQUIRED>

<!ELEMENT General ( DocLocation ) >
<!ATTLIST General productName CDATA #REQUIRED productVer CDATA #REQUIRED os CDATA #REQUIRED host CDATA #REQUIRED qcserver CDATA #IMPLIED qcproject CDATA #IMPLIED SolManSolutionId CDATA #IMPLIED SolManProjectId CDATA #IMPLIED SolManTestPlanId CDATA #IMPLIED SolManTestPackageId CDATA #IMPLIED SolManUserInfoData CDATA #IMPLIED  >

<!ELEMENT BPT (DName,Res,DVer?,TSet?,TInst?,NodeArgs,AdditionalInfo*,Doc*) >
<!ATTLIST BPT rID ID #REQUIRED >

<!ELEMENT Doc (DName,ConfName?,Res,DVer?,TSet?,TInst?,RunType?,DT?,AdditionalInfo*,Step*,DIter*,Step*,Action*,Doc*,Summary?,TestMaintenanceSummary*,NodeArgs?) >
<!ATTLIST Doc rID ID #REQUIRED type (Test|BC|BPTWrapperTest|Flow|Group|Action) "Test" productName CDATA #REQUIRED BCIter CDATA #IMPLIED >

<!ELEMENT RunType ( #PCDATA )>
<!ATTLIST RunType fmStep (False|True) "False" batch (False|True) "False" upDesc (False|True) "False" upChk (False|True) "False" upAS (False|True) "False">

<!ELEMENT DName ( #PCDATA ) >

<!ELEMENT ConfName ( #PCDATA ) >

<!ELEMENT Res ( #PCDATA ) >

<!ELEMENT AdditionalInfo (AdditionalDataName,AdditionalDataValue ) >

<!ELEMENT AdditionalDataName ( #PCDATA ) >

<!ELEMENT AdditionalDataValue ( #PCDATA ) >

<!ELEMENT DVer ( #PCDATA ) >

<!ELEMENT TSet ( #PCDATA ) >

<!ELEMENT TInst ( #PCDATA ) >

<!ELEMENT DIter (Step*,Action+,Summary?,NodeArgs)>
<!ATTLIST DIter rID ID #REQUIRED iterID CDATA #REQUIRED>

<!ELEMENT DocLocation ( #PCDATA )>

<!ELEMENT Action (AName,AIter*,(Step|HtmlStep|Action)*, Summary,ActionMaintenanceSummary*, NodeArgs ) >
<!ATTLIST Action rID ID #REQUIRED>

<!ELEMENT AIter ((Step|HtmlStep|Action)*,DataMapping?, Summary?,NodeArgs) >
<!ATTLIST AIter rID ID #REQUIRED iterID CDATA #REQUIRED isCountable (False|True) "False" >

<!ELEMENT AName ( #PCDATA ) >

<!ELEMENT TestMaintenanceSummary (ActionMaintenanceSummary*) >
<!ATTLIST TestMaintenanceSummary ObjectsAdded CDATA #REQUIRED ObjectsUpdated CDATA #REQUIRED StepsUpdated CDATA #REQUIRED StepsComments CDATA #REQUIRED><!ELEMENT ActionMaintenanceSummary (ObjectChange* ) >
<!ATTLIST ActionMaintenanceSummary Action CDATA #REQUIRED Objects CDATA #REQUIRED Updated CDATA #REQUIRED LinesTotal CDATA #REQUIRED Added CDATA #REQUIRED LinesUpdated CDATA #REQUIRED>

<!ELEMENT ObjectChange  (Hierarchy, PropertyChangeList* ) >
<!ATTLIST ObjectChange Operation CDATA #IMPLIED OriginalRepository CDATA #IMPLIED>

<!ELEMENT PropertyChangeList (PropertyDef*) >

<!ELEMENT PropertyDef (OriginalValue, NewValue) >
<!ATTLIST PropertyDef PropName CDATA #REQUIRED OriginRegularExpression (True|False) "False" NewRegularExpression (True|False) "False" AddedProperty (True|False) "False" >

<!ELEMENT OriginalValue ( #PCDATA )>

<!ELEMENT NewValue ( #PCDATA )>

<!ELEMENT Hierarchy  (ObjectName, Hierarchy*) >
<!ATTLIST Hierarchy MicClass CDATA #REQUIRED>

<!ELEMENT ObjectName  ( #PCDATA ) >

<!ELEMENT Step (Obj,Details,Time,TimeTick* ,(Step|HtmlStep|Doc)*, DataMapping?, NodeArgs) >
<!ATTLIST Step rID ID #REQUIRED retval CDATA #IMPLIED>

<!ELEMENT HtmlStep (HTML,TimeTick*,(Step|HtmlStep|Doc)*,NodeArgs) >
<!ATTLIST HtmlStep rID ID #REQUIRED >

<!ELEMENT Obj ( #PCDATA ) >
<!ATTLIST Obj plainTxt (False|True) "True">

<!ELEMENT Details ( #PCDATA ) >
<!ATTLIST Details plainTxt (False|True) "True">

<!ELEMENT Time ( #PCDATA ) >

<!ELEMENT HTML ( #PCDATA ) >

<!ELEMENT Disp ( #PCDATA ) >

<!ELEMENT TimeTick ( #PCDATA ) >

<!ELEMENT DataMapping ( DataMappedItem* )>
<!ELEMENT DataMappedItem EMPTY >
<!ATTLIST DataMappedItem dsName CDATA #REQUIRED >
<!ATTLIST DataMappedItem rowId CDATA #REQUIRED >

<!ELEMENT NodeArgs (Disp,TopPane?,BtmPane?,ExtendedInfo? )>
<!ATTLIST NodeArgs eType CDATA #REQUIRED icon CDATA #REQUIRED nRep CDATA #REQUIRED UserNote CDATA #IMPLIED filter (False|True) "True">
<!ATTLIST NodeArgs status (Passed|Failed|Done|Warning|Information) "Done">
<!ATTLIST NodeArgs iconSel CDATA #IMPLIED nType CDATA #IMPLIED MovieMarker CDATA "">
<!ATTLIST NodeArgs Source CDATA #IMPLIED SourceLine CDATA #IMPLIED StepFlowItemKey CDATA #IMPLIED >

<!ELEMENT TopPane (Path)>

<!ELEMENT BtmPane ( (Path|WR)?,ASHilite?)>
<!ATTLIST BtmPane vType CDATA "HTML">

<!ELEMENT Path ( #PCDATA ) >

<!ELEMENT ASHilite ( #PCDATA ) >

<!ELEMENT WR ( #PCDATA ) >

<!ELEMENT ExtendedInfo ( StepData ) >

<!ATTLIST ExtendedInfo StepType CDATA #REQUIRED>
<!ELEMENT DT (NodeArgs) >
<!ATTLIST DT rID ID #REQUIRED>

<!ELEMENT Summary (Param*)>
<!ATTLIST Summary sTime CDATA #IMPLIED eTime CDATA #IMPLIED passed CDATA #IMPLIED failed CDATA #IMPLIED warnings CDATA #IMPLIED retval CDATA #IMPLIED stopped (False|True) "False" >

<!ELEMENT Param (ParamName,ParamVal)+ >
<!ATTLIST Param paramInOut (In|Out) "In">

<!ELEMENT ParamName ( #PCDATA ) >

<!ELEMENT ParamVal ( #PCDATA ) >

]
>
<Report ver="2.0" tmZone="India Standard Time">
<General productName="Micro Focus Unified Functional Testing" productVer="14.50" os="" host="CHIGOWDA-L480"><DocLocation><![CDATA[C:\Proj_Automation\Drivers\Driver1]]></DocLocation></General>
<Doc rID="T1"   productName= "Micro Focus Unified Functional Testing"  >
<DName><![CDATA[Driver1]]></DName>
<Res><![CDATA[Res2]]></Res>
<DT rID="T2">
<NodeArgs eType="Table" icon="2" nRep="4" filter="False" >
<Disp><![CDATA[Run-Time Data Table]]></Disp>
<BtmPane vType="Table" >
<Path><![CDATA[Default.xls]]></Path>
</BtmPane>
</NodeArgs>
</DT>
<DIter rID="T3" iterID="1" >
<Action rID="T4">
<AName><![CDATA[Action1]]></AName>
<Step rID="T5">
<Obj plainTxt="False" ><![CDATA[Identity Cloud Service]]></Obj>
<Details plainTxt="False" ><![CDATA[<table><tr><td><span style="text-align : left; font-size : 12px; ">Local Browser</span></td></tr></table>]]></Details>
<Time><![CDATA[8/30/2021 - 14:14:28]]></Time>
<TimeTick>1630313068</TimeTick>
<Step rID="T6">
<Obj plainTxt="False" ><![CDATA[Identity Cloud Service]]></Obj>
<Details plainTxt="False" ><![CDATA[Page]]></Details>
<Time><![CDATA[8/30/2021 - 14:14:28]]></Time>
<TimeTick>1630313068</TimeTick>
<Step rID="T7">
<Obj plainTxt="False" ><![CDATA[User name or email.Set]]></Obj>
<Details plainTxt="False" ><![CDATA["chiranth.gowda@mtn.com"]]></Details>
<Time><![CDATA[8/30/2021 - 14:14:28]]></Time>
<TimeTick>1630313068</TimeTick>
<NodeArgs eType="Replay" icon="7" nRep="13" >
<Disp><![CDATA[User name or email.Set]]></Disp>
</NodeArgs>
</Step>
<Step rID="T8">
<Obj plainTxt="False" ><![CDATA[Password.Set]]></Obj>
<Details plainTxt="False" ><![CDATA["P@$$w0rdchi1@3"]]></Details>
<Time><![CDATA[8/30/2021 - 14:14:28]]></Time>
<TimeTick>1630313068</TimeTick>
<NodeArgs eType="Replay" icon="7" nRep="16" >
<Disp><![CDATA[Password.Set]]></Disp>
</NodeArgs>
</Step>
<Step rID="T9">
<Obj plainTxt="False" ><![CDATA[Sign In.Click]]></Obj>
<Details plainTxt="False" ><![CDATA[]]></Details>
<Time><![CDATA[8/30/2021 - 14:14:28]]></Time>
<TimeTick>1630313068</TimeTick>
<NodeArgs eType="Replay" icon="8" nRep="19" >
<Disp><![CDATA[Sign In.Click]]></Disp>
</NodeArgs>
</Step>
<NodeArgs eType="Context" icon="6" nRep="12" >
<Disp><![CDATA[Identity Cloud Service]]></Disp>
</NodeArgs>
</Step>
<Step rID="T10">
<Obj plainTxt="False" ><![CDATA[Welcome]]></Obj>
<Details plainTxt="False" ><![CDATA[Page]]></Details>
<Time><![CDATA[8/30/2021 - 14:14:33]]></Time>
<TimeTick>1630313073</TimeTick>
<Step rID="T11">
<Obj plainTxt="False" ><![CDATA[Home.Click]]></Obj>
<Details plainTxt="False" ><![CDATA[]]></Details>
<Time><![CDATA[8/30/2021 - 14:14:33]]></Time>
<TimeTick>1630313073</TimeTick>
<NodeArgs eType="Replay" icon="9" nRep="32" >
<Disp><![CDATA[Home.Click]]></Disp>
</NodeArgs>
</Step>
<NodeArgs eType="Context" icon="6" nRep="31" >
<Disp><![CDATA[Welcome]]></Disp>
</NodeArgs>
</Step>
<Step rID="T12">
<Obj plainTxt="False" ><![CDATA[Oracle Applications]]></Obj>
<Details plainTxt="False" ><![CDATA[Page]]></Details>
<Time><![CDATA[8/30/2021 - 14:14:35]]></Time>
<TimeTick>1630313075</TimeTick>
<Step rID="T13">
<Obj plainTxt="False" ><![CDATA[My Client Groups.Click]]></Obj>
<Details plainTxt="False" ><![CDATA[]]></Details>
<Time><![CDATA[8/30/2021 - 14:14:35]]></Time>
<TimeTick>1630313075</TimeTick>
<NodeArgs eType="Replay" icon="9" nRep="39" >
<Disp><![CDATA[My Client Groups.Click]]></Disp>
</NodeArgs>
</Step>
<Step rID="T14">
<Obj plainTxt="False" ><![CDATA[WebElement.Click]]></Obj>
<Details plainTxt="False" ><![CDATA[]]></Details>
<Time><![CDATA[8/30/2021 - 14:14:40]]></Time>
<TimeTick>1630313080</TimeTick>
<NodeArgs eType="Replay" icon="10" nRep="42" >
<Disp><![CDATA[WebElement.Click]]></Disp>
</NodeArgs>
</Step>
<NodeArgs eType="Context" icon="6" nRep="38" >
<Disp><![CDATA[Oracle Applications]]></Disp>
</NodeArgs>
</Step>
<Step rID="T15">
<Obj plainTxt="False" ><![CDATA[Search Person - Person]]></Obj>
<Details plainTxt="False" ><![CDATA[Page]]></Details>
<Time><![CDATA[8/30/2021 - 14:14:44]]></Time>
<TimeTick>1630313084</TimeTick>
<Step rID="T16">
<Obj plainTxt="False" ><![CDATA[_FOpt1:_FOr1:0:_FONSr2:0:MAt1:.Set]]></Obj>
<Details plainTxt="False" ><![CDATA["188029"]]></Details>
<Time><![CDATA[8/30/2021 - 14:14:44]]></Time>
<TimeTick>1630313084</TimeTick>
<NodeArgs eType="Replay" icon="7" nRep="52" >
<Disp><![CDATA[_FOpt1:_FOr1:0:_FONSr2:0:MAt1:.Set]]></Disp>
</NodeArgs>
</Step>
<Step rID="T17">
<Obj plainTxt="False" ><![CDATA[Search.Click]]></Obj>
<Details plainTxt="False" ><![CDATA[]]></Details>
<Time><![CDATA[8/30/2021 - 14:14:44]]></Time>
<TimeTick>1630313084</TimeTick>
<NodeArgs eType="Replay" icon="8" nRep="55" >
<Disp><![CDATA[Search.Click]]></Disp>
</NodeArgs>
</Step>
<Step rID="T18">
<Obj plainTxt="False" ><![CDATA[Coleman, Prince Henry.Click]]></Obj>
<Details plainTxt="False" ><![CDATA[]]></Details>
<Time><![CDATA[8/30/2021 - 14:14:45]]></Time>
<TimeTick>1630313085</TimeTick>
<NodeArgs eType="Replay" icon="9" nRep="59" >
<Disp><![CDATA[Coleman, Prince Henry.Click]]></Disp>
</NodeArgs>
</Step>
<Step rID="T19">
<Obj plainTxt="False" ><![CDATA[Coleman, Prince Henry.Exist]]></Obj>
<Details plainTxt="False" ><![CDATA["Object exists"]]></Details>
<Time><![CDATA[8/30/2021 - 14:14:45]]></Time>
<TimeTick>1630313085</TimeTick>
<NodeArgs eType="Replay" icon="9" nRep="61" >
<Disp><![CDATA[Coleman, Prince Henry.Exist]]></Disp>
</NodeArgs>
</Step>
<Step rID="T20">
<Obj plainTxt="False" ><![CDATA[Home.Click]]></Obj>
<Details plainTxt="False" ><![CDATA[]]></Details>
<Time><![CDATA[8/30/2021 - 14:14:45]]></Time>
<TimeTick>1630313085</TimeTick>
<NodeArgs eType="Replay" icon="9" nRep="64" >
<Disp><![CDATA[Home.Click]]></Disp>
</NodeArgs>
</Step>
<NodeArgs eType="Context" icon="6" nRep="51" >
<Disp><![CDATA[Search Person - Person]]></Disp>
</NodeArgs>
</Step>
<NodeArgs eType="Context" icon="5" nRep="11" >
<Disp><![CDATA[Identity Cloud Service]]></Disp>
</NodeArgs>
</Step>
<Step rID="T21">
<Obj plainTxt="False" ><![CDATA[Welcome]]></Obj>
<Details plainTxt="False" ><![CDATA[<table><tr><td><span style="text-align : left; font-size : 12px; ">Local Browser</span></td></tr></table>]]></Details>
<Time><![CDATA[8/30/2021 - 14:14:50]]></Time>
<TimeTick>1630313090</TimeTick>
<Step rID="T22">
<Obj plainTxt="False" ><![CDATA[Welcome]]></Obj>
<Details plainTxt="False" ><![CDATA[Page]]></Details>
<Time><![CDATA[8/30/2021 - 14:14:50]]></Time>
<TimeTick>1630313090</TimeTick>
<Step rID="T23">
<Obj plainTxt="False" ><![CDATA[Home.Click]]></Obj>
<Details plainTxt="False" ><![CDATA[]]></Details>
<Time><![CDATA[8/30/2021 - 14:14:50]]></Time>
<TimeTick>1630313090</TimeTick>
<NodeArgs eType="Replay" icon="9" nRep="69" >
<Disp><![CDATA[Home.Click]]></Disp>
</NodeArgs>
</Step>
<NodeArgs eType="Context" icon="6" nRep="68" >
<Disp><![CDATA[Welcome]]></Disp>
</NodeArgs>
</Step>
<Step rID="T24">
<Obj plainTxt="False" ><![CDATA[Oracle Applications]]></Obj>
<Details plainTxt="False" ><![CDATA[Page]]></Details>
<Time><![CDATA[8/30/2021 - 14:14:53]]></Time>
<TimeTick>1630313093</TimeTick>
<Step rID="T25">
<Obj plainTxt="False" ><![CDATA[My Client Groups.Click]]></Obj>
<Details plainTxt="False" ><![CDATA[]]></Details>
<Time><![CDATA[8/30/2021 - 14:14:53]]></Time>
<TimeTick>1630313093</TimeTick>
<NodeArgs eType="Replay" icon="9" nRep="73" >
<Disp><![CDATA[My Client Groups.Click]]></Disp>
</NodeArgs>
</Step>
<Step rID="T26">
<Obj plainTxt="False" ><![CDATA[WebElement_2.Click]]></Obj>
<Details plainTxt="False" ><![CDATA[]]></Details>
<Time><![CDATA[8/30/2021 - 14:14:54]]></Time>
<TimeTick>1630313094</TimeTick>
<NodeArgs eType="Replay" icon="10" nRep="76" >
<Disp><![CDATA[WebElement_2.Click]]></Disp>
</NodeArgs>
</Step>
<NodeArgs eType="Context" icon="6" nRep="72" >
<Disp><![CDATA[Oracle Applications]]></Disp>
</NodeArgs>
</Step>
<Step rID="T27">
<Obj plainTxt="False" ><![CDATA[Search Person - Person]]></Obj>
<Details plainTxt="False" ><![CDATA[Page]]></Details>
<Time><![CDATA[8/30/2021 - 14:14:56]]></Time>
<TimeTick>1630313096</TimeTick>
<Step rID="T28">
<Obj plainTxt="False" ><![CDATA[_FOpt1:_FOr1:0:_FONSr2:0:MAt1:.Set]]></Obj>
<Details plainTxt="False" ><![CDATA["188029"]]></Details>
<Time><![CDATA[8/30/2021 - 14:14:56]]></Time>
<TimeTick>1630313096</TimeTick>
<NodeArgs eType="Replay" icon="7" nRep="84" >
<Disp><![CDATA[_FOpt1:_FOr1:0:_FONSr2:0:MAt1:.Set]]></Disp>
</NodeArgs>
</Step>
<Step rID="T29">
<Obj plainTxt="False" ><![CDATA[Search.Click]]></Obj>
<Details plainTxt="False" ><![CDATA[]]></Details>
<Time><![CDATA[8/30/2021 - 14:14:57]]></Time>
<TimeTick>1630313097</TimeTick>
<NodeArgs eType="Replay" icon="8" nRep="87" >
<Disp><![CDATA[Search.Click]]></Disp>
</NodeArgs>
</Step>
<Step rID="T30">
<Obj plainTxt="False" ><![CDATA[Coleman, Prince Henry.Click]]></Obj>
<Details plainTxt="False" ><![CDATA[]]></Details>
<Time><![CDATA[8/30/2021 - 14:14:58]]></Time>
<TimeTick>1630313098</TimeTick>
<NodeArgs eType="Replay" icon="9" nRep="92" >
<Disp><![CDATA[Coleman, Prince Henry.Click]]></Disp>
</NodeArgs>
</Step>
<Step rID="T31">
<Obj plainTxt="False" ><![CDATA[Tasks.Click]]></Obj>
<Details plainTxt="False" ><![CDATA[]]></Details>
<Time><![CDATA[8/30/2021 - 14:15:09]]></Time>
<TimeTick>1630313109</TimeTick>
<NodeArgs eType="Replay" icon="11" nRep="112" >
<Disp><![CDATA[Tasks.Click]]></Disp>
</NodeArgs>
</Step>
<Step rID="T32">
<Obj plainTxt="False" ><![CDATA[Absence Records.Click]]></Obj>
<Details plainTxt="False" ><![CDATA[]]></Details>
<Time><![CDATA[8/30/2021 - 14:15:15]]></Time>
<TimeTick>1630313115</TimeTick>
<NodeArgs eType="Replay" icon="9" nRep="115" >
<Disp><![CDATA[Absence Records.Click]]></Disp>
</NodeArgs>
</Step>
<Step rID="T33">
<Obj plainTxt="False" ><![CDATA[Absence Records.Exist]]></Obj>
<Details plainTxt="False" ><![CDATA["Object exists"]]></Details>
<Time><![CDATA[8/30/2021 - 14:15:15]]></Time>
<TimeTick>1630313115</TimeTick>
<NodeArgs eType="Replay" icon="9" nRep="117" >
<Disp><![CDATA[Absence Records.Exist]]></Disp>
</NodeArgs>
</Step>
<Step rID="T34">
<Obj plainTxt="False" ><![CDATA[Close.Click]]></Obj>
<Details plainTxt="False" ><![CDATA[]]></Details>
<Time><![CDATA[8/30/2021 - 14:15:15]]></Time>
<TimeTick>1630313115</TimeTick>
<NodeArgs eType="Replay" icon="8" nRep="120" >
<Disp><![CDATA[Close.Click]]></Disp>
</NodeArgs>
</Step>
<Step rID="T35">
<Obj plainTxt="False" ><![CDATA[Home.Click]]></Obj>
<Details plainTxt="False" ><![CDATA[]]></Details>
<Time><![CDATA[8/30/2021 - 14:15:15]]></Time>
<TimeTick>1630313115</TimeTick>
<NodeArgs eType="Replay" icon="9" nRep="123" >
<Disp><![CDATA[Home.Click]]></Disp>
</NodeArgs>
</Step>
<NodeArgs eType="Context" icon="6" nRep="83" >
<Disp><![CDATA[Search Person - Person]]></Disp>
</NodeArgs>
</Step>
<NodeArgs eType="Context" icon="5" nRep="67" >
<Disp><![CDATA[Welcome]]></Disp>
</NodeArgs>
</Step>
<Step rID="T36">
<Obj plainTxt="False" ><![CDATA[Identity Cloud Service]]></Obj>
<Details plainTxt="False" ><![CDATA[<table><tr><td><span style="text-align : left; font-size : 12px; ">Local Browser</span></td></tr></table>]]></Details>
<Time><![CDATA[8/30/2021 - 14:15:20]]></Time>
<TimeTick>1630313120</TimeTick>
<Step rID="T37">
<Obj plainTxt="False" ><![CDATA[Welcome]]></Obj>
<Details plainTxt="False" ><![CDATA[Page]]></Details>
<Time><![CDATA[8/30/2021 - 14:15:20]]></Time>
<TimeTick>1630313120</TimeTick>
<Step rID="T38">
<Obj plainTxt="False" ><![CDATA[Home.Click]]></Obj>
<Details plainTxt="False" ><![CDATA[]]></Details>
<Time><![CDATA[8/30/2021 - 14:15:20]]></Time>
<TimeTick>1630313120</TimeTick>
<NodeArgs eType="Replay" icon="9" nRep="128" >
<Disp><![CDATA[Home.Click]]></Disp>
</NodeArgs>
</Step>
<NodeArgs eType="Context" icon="6" nRep="127" >
<Disp><![CDATA[Welcome]]></Disp>
</NodeArgs>
</Step>
<Step rID="T39">
<Obj plainTxt="False" ><![CDATA[Oracle Applications]]></Obj>
<Details plainTxt="False" ><![CDATA[Page]]></Details>
<Time><![CDATA[8/30/2021 - 14:15:20]]></Time>
<TimeTick>1630313120</TimeTick>
<Step rID="T40">
<Obj plainTxt="False" ><![CDATA[My Client Groups.Click]]></Obj>
<Details plainTxt="False" ><![CDATA[]]></Details>
<Time><![CDATA[8/30/2021 - 14:15:20]]></Time>
<TimeTick>1630313120</TimeTick>
<NodeArgs eType="Replay" icon="9" nRep="132" >
<Disp><![CDATA[My Client Groups.Click]]></Disp>
</NodeArgs>
</Step>
<Step rID="T41">
<Obj plainTxt="False" ><![CDATA[WebElement_3.Click]]></Obj>
<Details plainTxt="False" ><![CDATA[]]></Details>
<Time><![CDATA[8/30/2021 - 14:15:24]]></Time>
<TimeTick>1630313124</TimeTick>
<NodeArgs eType="Replay" icon="10" nRep="135" >
<Disp><![CDATA[WebElement_3.Click]]></Disp>
</NodeArgs>
</Step>
<NodeArgs eType="Context" icon="6" nRep="131" >
<Disp><![CDATA[Oracle Applications]]></Disp>
</NodeArgs>
</Step>
<Step rID="T42">
<Obj plainTxt="False" ><![CDATA[Search Person - Person]]></Obj>
<Details plainTxt="False" ><![CDATA[Page]]></Details>
<Time><![CDATA[8/30/2021 - 14:15:26]]></Time>
<TimeTick>1630313126</TimeTick>
<Step rID="T43">
<Obj plainTxt="False" ><![CDATA[_FOpt1:_FOr1:0:_FONSr2:0:MAt1:.Set]]></Obj>
<Details plainTxt="False" ><![CDATA["188164"]]></Details>
<Time><![CDATA[8/30/2021 - 14:15:26]]></Time>
<TimeTick>1630313126</TimeTick>
<NodeArgs eType="Replay" icon="7" nRep="143" >
<Disp><![CDATA[_FOpt1:_FOr1:0:_FONSr2:0:MAt1:.Set]]></Disp>
</NodeArgs>
</Step>
<Step rID="T44">
<Obj plainTxt="False" ><![CDATA[Search.Click]]></Obj>
<Details plainTxt="False" ><![CDATA[]]></Details>
<Time><![CDATA[8/30/2021 - 14:15:27]]></Time>
<TimeTick>1630313127</TimeTick>
<NodeArgs eType="Replay" icon="8" nRep="146" >
<Disp><![CDATA[Search.Click]]></Disp>
</NodeArgs>
</Step>
<Step rID="T45">
<Obj plainTxt="False" ><![CDATA[Dotcher, Felix.Click]]></Obj>
<Details plainTxt="False" ><![CDATA[]]></Details>
<Time><![CDATA[8/30/2021 - 14:15:27]]></Time>
<TimeTick>1630313127</TimeTick>
<NodeArgs eType="Replay" icon="9" nRep="150" >
<Disp><![CDATA[Dotcher, Felix.Click]]></Disp>
</NodeArgs>
</Step>
<Step rID="T46">
<Obj plainTxt="False" ><![CDATA[Tasks.Click]]></Obj>
<Details plainTxt="False" ><![CDATA[]]></Details>
<Time><![CDATA[8/30/2021 - 14:15:33]]></Time>
<TimeTick>1630313133</TimeTick>
<NodeArgs eType="Replay" icon="11" nRep="160" >
<Disp><![CDATA[Tasks.Click]]></Disp>
</NodeArgs>
</Step>
<Step rID="T47">
<Obj plainTxt="False" ><![CDATA[View Compensation History.Click]]></Obj>
<Details plainTxt="False" ><![CDATA[]]></Details>
<Time><![CDATA[8/30/2021 - 14:15:38]]></Time>
<TimeTick>1630313138</TimeTick>
<NodeArgs eType="Replay" icon="9" nRep="163" >
<Disp><![CDATA[View Compensation History.Click]]></Disp>
</NodeArgs>
</Step>
<Step rID="T48">
<Obj plainTxt="False" ><![CDATA[View Compensation History.Exist]]></Obj>
<Details plainTxt="False" ><![CDATA["Object exists"]]></Details>
<Time><![CDATA[8/30/2021 - 14:15:38]]></Time>
<TimeTick>1630313138</TimeTick>
<NodeArgs eType="Replay" icon="9" nRep="165" >
<Disp><![CDATA[View Compensation History.Exist]]></Disp>
</NodeArgs>
</Step>
<Step rID="T49">
<Obj plainTxt="False" ><![CDATA[Home.Click]]></Obj>
<Details plainTxt="False" ><![CDATA[]]></Details>
<Time><![CDATA[8/30/2021 - 14:15:44]]></Time>
<TimeTick>1630313144</TimeTick>
<NodeArgs eType="Replay" icon="9" nRep="168" >
<Disp><![CDATA[Home.Click]]></Disp>
</NodeArgs>
</Step>
<NodeArgs eType="Context" icon="6" nRep="142" >
<Disp><![CDATA[Search Person - Person]]></Disp>
</NodeArgs>
</Step>
<NodeArgs eType="Context" icon="5" nRep="126" >
<Disp><![CDATA[Identity Cloud Service]]></Disp>
</NodeArgs>
</Step>
<Summary sTime="8/30/2021 - 14:14:17" eTime="8/30/2021 - 14:15:44" passed="0" failed="0" warnings="0" ></Summary>
<NodeArgs eType="StartAction" icon="4" nRep="8" >
<Disp><![CDATA[Action1 Summary]]></Disp>
</NodeArgs>
</Action>
<NodeArgs eType="StartIteration" icon="3" nRep="6" >
<Disp><![CDATA[Driver1 Iteration 1 (Row 1)]]></Disp>
</NodeArgs>
</DIter>
<Summary sTime="8/30/2021 - 14:14:08" eTime="8/30/2021 - 14:15:44" passed="0" failed="0" warnings="0" ></Summary>
<NodeArgs eType="StartTest" icon="1" nRep="3" >
<Disp><![CDATA[Test Driver1 Summary]]></Disp>
</NodeArgs>
</Doc>
</Report>